{
    "$schema": "https://json-schema.org/draft/2020-12/schema",
    "$id": "https://example.com/sop-class-schema",
    "type": "object",
    "required": [
        "version",
        "default",
        "dicomStandardVersion",
        "justification",
        "sopClass"
    ],
    "properties": {
        "version": {
            "type": "string",
            "pattern": "^\\d{4}\\.([1-9]|1[0-2])\\.\\d+$"
        },
        "default": {
            "$ref": "#/$defs/defaultEnum"
        },
        "dicomStandardVersion": {
            "type": "string",
            "minLength": 1
        },
        "justification": {
            "type": "string",
            "minLength": 1
        },
        "sopClass": {
            "type": "object",
            "additionalProperties": {
                "type": "object",
                "required": [
                    "default",
                    "justification",
                    "tag"
                ],
                "properties": {
                    "default": {
                        "$ref": "#/$defs/defaultEnum"
                    },
                    "justification": {
                        "type": "string",
                        "minLength": 1
                    },
                    "tag": {
                        "type": "object",
                        "propertyNames": {
                            "pattern": "\\([0-9A-FX]{4},[0-9A-FX]{4}\\)"
                        },
                        "additionalProperties": {
                            "type": "object",
                            "required": [
                                "default",
                                "justification"
                            ],
                            "properties": {
                                "default": {
                                    "$ref": "#/$defs/defaultEnum"
                                },
                                "justification": {
                                    "type": "string",
                                    "minLength": 1
                                }
                            },
                            "additionalProperties": false
                        }
                    }
                },
                "additionalProperties": false
            }
        }
    },
    "additionalProperties": false,
    "$defs": {
        "defaultEnum": {
            "type": "string",
            "enum": [
                "X",
                "K",
                "D",
                "Z",
                "U",
                "R"
            ]
        }
    }
}
